{
  "schema_version": "1.0.0",
  "run_id": "run-01JQ8Z4K2M0000000000000001",
  "acquisition_id": "acq-01JQ8Z4K2M0000000000000011",
  "sampling_manifest_ref": "smf-01JQ8Z4K2M0000000000000002",
  "sampling_manifest_output_digest": "sha256:2ce0498ba46d3185f1323976cee3397621b091c90369efb84fcb85142b0b32d6",
  "url_key": "https://example.com/kontakt",
  "observation_mode": "STATIC_HTTP",
  "acquisition_method": "STATIC_HTTP_PAGE_FETCH",
  "acquisition_method_version": "1.0.0",
  "acquired_at": "2026-09-19T09:12:48Z",
  "acquisition_outcome": "TIMEOUT",
  "measurement_refs": [
    "msr-01JQ8Z4K2M0000000000000031",
    "msr-01JQ8Z4K2M0000000000000032"
  ]
}
